{
  "apiVersion": "graph.socioprophet.dev/v1",
  "kind": "CSKGEdge",
  "metadata": { "edgeId": "cskg-edge:inst/0001", "createdAt": "2026-08-03T00:00:00Z" },
  "spec": {
    "node1": "grant://sociosphere/2026/AF-0007",
    "relation": "HasStatus",
    "node2": "status:awarded",
    "truth": { "strength": 1.0, "confidence": 1.0 },
    "epistemicTier": "institutional",
    "defeasible": false,
    "status": "promoted",
    "provenance": { "source": "corpus:SP-AWARDS-2026", "extractor": "exodus-intake-v0.1.0" },
    "temporal": { "validFromMicros": 1754179200000000, "validToMicros": null, "observedAtMicros": 1754179200000000 }
  }
}
